章番号,問題番号,分類名称,問題文,選択肢１,選択肢２,選択肢３,選択肢４,選択肢５,解答番号,解答,解説
SECT001,Q0010,所得税,金融商品の収益と所得区分の組合せとして、誤っているものは次のうちどれですか。,国債の利子＝利子所得,株式の配当＝配当所得,金貯蓄口座の利益＝譲渡所得,みなし配当＝一時配当,抵当証券の利息＝雑所得,4,みなし配当＝一時配当,正解は４。#金融(類似)商品の収益による所得は、利子所得や配当所得以外に一時所得、雑所得に該当するものがある。配当所得には、中間配当(金銭の分配)やみなし配当も含まれる。抵当証券の利息は、雑所得に該当する。
SECT001,Q0020,所得税,利子所得に該当するものは、次のうちどれですか。,基金利息,株式投資信託の収益の分配,合同運用信託(金銭信託)の収益の分配,外貨建預貯金の為替差益,個人間の貸付にかかる利息,3,合同運用信託(金銭信託)の収益の分配,正解は３。#利子所得は次に掲げる利子等にかかる所得をいう。#・公社債の利子#・預貯金の利子#・合同運用信託の収益の分配#・公社債投資信託の収益の分配#・公募公社債等運用投資信託の収益の分配#なお、基金利息および株式投資信託の収益の分配は配当所得に、外貨建預貯金の為替差益及び個人間の貸付にかかる利息は雑所得に該当する。
SECT001,Q0030,所得税,株式等の配当所得にかかる申告分離課税について、誤っているものは次のうちどれですか。,一定の上場株式の配当等について、申告分離課税を選択することができる,配当等の収入金額が50万円未満のものについてのみ、申告分離課税を選択することが出来る。,申告分離課税を選択した一定の上場株式等の配当等についても、軽減税率が適用される。,申告分離課税を選択した上場株式等の配当等については、配当控除の適用対象とされない。,一定の上場株式等の譲渡損失がある時は、申告分離課税を選択した上場株式等の配当所得の金額から控除することが出来る。,2,配当等の収入金額が50万円未満のものについてのみ、申告分離課税を選択することが出来る。,正解は２。#平成21年１月１日以後に支払を受ける、一定の上場株式等の配当等について、確定申告をする場合には、総合課税とともに申告分離課税(確定申告をして分離課税を受けること)を選択することができる。#申告分離課税を選択すると、他の所得金額と区分してその年中の上場株式等の配当等にかかる課税配当所得の金額に対し、居住者については原則所得税15%・住民税5%の税率で単独課税される。ただし、申告分離課税の適用を受けた上場株式等の配当等にかかる配当所得については、、配当控除の適用は受けられない。#なお、上場株式の配当等にかかる申告分離課税の適用につき、配当収入金額の多寡による制限は設けられていない。
SECT001,Q0040,所得税,所得税率15％(住民税5%)により源泉分離課税されるものは、次のうちどれですか。,公社債投資信託の収益の分配,割引債の償還差益,金(地金)の譲渡益,学校債の利子,組合債の利子,1,公社債投資信託の収益の分配,正解は１。#源泉分離課税の対象となる所得のうち、所属税15%・住民税5%の税率により課税されるものは、利子所得の他、いわゆる金融類似商品としてその収益が利子所得と同様の課税扱いとされるとされるもので、例えば定期積金の給付補填金、抵当証券の利息、保険料一時払いの生命保険契約で保険期間が５年以下、または５年超で５年以内に解約されたものに基づく差益、貴金属の売戻条件付売買の利益、懸賞金付預貯金の懸賞金等である。#ただし、割引債の償還差益については、所得税のみ18％の源泉分離課税が適用される。
SECT001,Q0050,所得税,不動産所得の金額の計算上、総収入金額に含まれるものは、次のうちどれですか。,事業主の責任において車両を保管する時間極めの有料駐車場の料金収入,10室以上の貸付を行う賃貸アパートの賃貸料収入,賃貸建物の譲渡による収入金額,事業主が提供する従業員向け宿舎の賃貸料収入,棚卸資産として保有する建物の一時的な貸付による使用料収入,2,10室以上の貸付を行う賃貸アパートの賃貸料収入,正解は２。#不動産所得とは、不動産、不動産の上に存する権利、船舶または航空機の貸付による所得である。#不動産等の貸付にともない収受する賃料や更新料等は、貸付の規模が事業的かどうかにかかわらず、不動産所得の総収入金額に算入される。#いわゆる有料駐車場、有料自転車置き場等の所得については、事故の責任において他人の物を補完する場合の所得は事業所得または雑所得に該当し、そうでない場合は不動産所得に該当する。
SECT001,Q0060,所得税,不動産所得の金額の計算上、原則として必要経費に参入されないものは、次のうちどれですか。,貸家の修繕費用,貸家の増築／改築費用,貸家の減価償却費,貸家にかかる固定資産税額,貸家の取壊しに伴う損失金額,2,貸家の増築／改築費用,正解は２。#増築や改築は、土地や建物(固定資産)の取得に該当し、その費用は不動産所得の必要経費ではなく、その資産の譲渡所得等の金額計算の際の取得費とされる。
SECT001,Q0070,所得税,原則として、譲渡所得の課税対象とされるものは、次のうちどれですか。,生活用動産の譲渡所得,金銭債権の譲渡所得,公社債の譲渡所得,棚卸資産の譲渡所得,ゴルフ会員権(株式)の譲渡所得,5,ゴルフ会員権(株式)の譲渡所得,正解は５。#資産の譲渡による所得は原則として譲渡所得に該当し、総合課税または分離課税の適用対象とされる。ただし、次のものは他の所得として課税される。#・金銭債権の譲渡(事業所得または雑所得)#・棚卸資産の譲渡(事業所得または雑所得)#・山林の伐採または譲渡(山林所得、事業所得または雑所得)#・営利を目的とした継続的な譲渡(事業所得または雑所得)#なお、自己またはその配偶者その他親族が生活の用に供する家具、什器、衣服その他の資産で政令で定めるものの譲渡による所得、公社債や公社債投資信託・貸付信託の受益権等の譲渡による所得、生活用動産の譲渡については非課税とされる。#従って、これらに該当しないゴルフ会員権の譲渡は譲渡所得の課税対象となる。
[EOF],,,,,,,,,,,